{
  "attribution": "Fluxion contributors",
  "categories": {
    "charts": {
      "path": "categories/charts.json",
      "sha256": "403c638493e8a501445537cdd4fc42f5a40bb6e154b0593798c39c95d917775b"
    },
    "diagrams": {
      "path": "categories/diagrams.json",
      "sha256": "b3f1824017e0d3d89f226f1321c41a64bba4d2486ee4229ad0d717e8868dd43d"
    },
    "labels": {
      "path": "categories/labels.json",
      "sha256": "9ce1bbadf0319bb3afe0accf461bef4f6550a9c96b86ccb3f1cbba371dac64c7"
    },
    "layers": {
      "path": "categories/layers.json",
      "sha256": "b9f2e4954c0f82ee68a17a610642595f5ed2e3ac310ff72223f908bc5ce81ed4"
    }
  },
  "credits": [
    {
      "attribution": "Fluxion contributors",
      "id": "fluxion",
      "license": "MIT",
      "notice": "Copyright (c) 2026 Fluxion contributors. Released under the MIT License.",
      "source": {
        "author": "Fluxion contributors",
        "kind": "original",
        "statement": "Original artwork drawn for Fluxion."
      }
    }
  ],
  "definitions": [
    {
      "category": "charts",
      "id": "infographic:pie",
      "keywords": [
        "pie",
        "slice",
        "share",
        "percentage",
        "chart"
      ],
      "name": "Pie slice"
    },
    {
      "category": "charts",
      "id": "infographic:donut",
      "keywords": [
        "donut",
        "ring",
        "progress",
        "percentage",
        "chart"
      ],
      "name": "Donut segment"
    },
    {
      "category": "charts",
      "id": "infographic:gauge",
      "keywords": [
        "gauge",
        "dial",
        "meter",
        "speedometer",
        "score"
      ],
      "name": "Gauge"
    },
    {
      "category": "charts",
      "id": "infographic:progress",
      "keywords": [
        "progress",
        "bar",
        "completion",
        "capacity",
        "percentage"
      ],
      "name": "Progress bar"
    },
    {
      "category": "charts",
      "id": "infographic:target",
      "keywords": [
        "target",
        "goal",
        "bullseye",
        "focus",
        "objective"
      ],
      "name": "Target"
    },
    {
      "category": "diagrams",
      "id": "infographic:venn",
      "keywords": [
        "venn",
        "overlap",
        "intersection",
        "sets",
        "compare"
      ],
      "name": "Venn pair"
    },
    {
      "category": "diagrams",
      "id": "infographic:matrix",
      "keywords": [
        "matrix",
        "quadrant",
        "grid",
        "two by two",
        "swot"
      ],
      "name": "Two-by-two matrix"
    },
    {
      "category": "layers",
      "id": "infographic:funnel",
      "keywords": [
        "funnel",
        "conversion",
        "stages",
        "filter",
        "sales"
      ],
      "name": "Funnel"
    },
    {
      "category": "layers",
      "id": "infographic:funnel-layer",
      "keywords": [
        "funnel",
        "layer",
        "stage",
        "trapezoid"
      ],
      "name": "Funnel layer"
    },
    {
      "category": "layers",
      "id": "infographic:pyramid",
      "keywords": [
        "pyramid",
        "hierarchy",
        "tiers",
        "levels",
        "triangle"
      ],
      "name": "Pyramid"
    },
    {
      "category": "labels",
      "id": "infographic:step-pill",
      "keywords": [
        "step",
        "pill",
        "numbered",
        "list",
        "stage"
      ],
      "name": "Step pill"
    },
    {
      "category": "labels",
      "id": "infographic:number-badge",
      "keywords": [
        "badge",
        "number",
        "rank",
        "count",
        "circle"
      ],
      "name": "Number badge"
    },
    {
      "category": "labels",
      "id": "infographic:hexagon-tile",
      "keywords": [
        "hexagon",
        "tile",
        "honeycomb",
        "feature",
        "capability"
      ],
      "name": "Hexagon tile"
    },
    {
      "category": "labels",
      "id": "infographic:stat-card",
      "keywords": [
        "stat",
        "kpi",
        "metric",
        "number",
        "card"
      ],
      "name": "Stat card"
    },
    {
      "category": "labels",
      "id": "infographic:banner",
      "keywords": [
        "banner",
        "ribbon",
        "title",
        "heading",
        "announcement"
      ],
      "name": "Banner"
    },
    {
      "category": "labels",
      "id": "infographic:milestone",
      "keywords": [
        "milestone",
        "timeline",
        "event",
        "date",
        "marker"
      ],
      "name": "Milestone"
    }
  ],
  "format": "fluxion-shape-pack",
  "formatVersion": "1.0",
  "id": "infographic",
  "license": "MIT",
  "name": "Infographic",
  "version": "0.0.0"
}
