{
  "attribution": "Fluxion contributors",
  "categories": {
    "data": {
      "path": "categories/data.json",
      "sha256": "90f2e10ff5e9d18e3adbe73751e643023bc1e7d3fd337050c8fe3133d6bcf06b"
    },
    "flow": {
      "path": "categories/flow.json",
      "sha256": "34dff4dfd666291b9d19f80ae967bf14e2dfcb3bb63b2ff9c7c93486e0bf9287"
    },
    "process": {
      "path": "categories/process.json",
      "sha256": "edb099593681c73f12bbc06ce1db3d66a2c4040371ac2448e273da427be8c38e"
    }
  },
  "credits": [
    {
      "attribution": "Fluxion contributors",
      "id": "fluxion",
      "license": "MIT",
      "notice": "Copyright (c) 2026 Fluxion contributors. Released under the MIT License.",
      "source": {
        "author": "Fluxion contributors",
        "kind": "original",
        "statement": "Original artwork drawn for Fluxion."
      }
    }
  ],
  "definitions": [
    {
      "category": "process",
      "id": "flowchart:process",
      "keywords": [
        "process",
        "step",
        "action",
        "task"
      ],
      "name": "Process"
    },
    {
      "category": "process",
      "id": "flowchart:alternate-process",
      "keywords": [
        "alternate",
        "process",
        "step",
        "rounded"
      ],
      "name": "Alternate process"
    },
    {
      "category": "process",
      "id": "flowchart:decision",
      "keywords": [
        "decision",
        "branch",
        "condition",
        "if",
        "diamond"
      ],
      "name": "Decision"
    },
    {
      "category": "process",
      "id": "flowchart:terminator",
      "keywords": [
        "terminator",
        "start",
        "end",
        "stop",
        "begin"
      ],
      "name": "Terminator"
    },
    {
      "category": "process",
      "id": "flowchart:predefined-process",
      "keywords": [
        "predefined",
        "subroutine",
        "function",
        "call"
      ],
      "name": "Predefined process"
    },
    {
      "category": "process",
      "id": "flowchart:preparation",
      "keywords": [
        "preparation",
        "setup",
        "initialise",
        "loop",
        "hexagon"
      ],
      "name": "Preparation"
    },
    {
      "category": "process",
      "id": "flowchart:manual-operation",
      "keywords": [
        "manual",
        "operation",
        "human",
        "trapezoid"
      ],
      "name": "Manual operation"
    },
    {
      "category": "process",
      "id": "flowchart:delay",
      "keywords": [
        "delay",
        "wait",
        "pause"
      ],
      "name": "Delay"
    },
    {
      "category": "data",
      "id": "flowchart:data",
      "keywords": [
        "data",
        "input",
        "output",
        "io",
        "parallelogram"
      ],
      "name": "Data"
    },
    {
      "category": "data",
      "id": "flowchart:manual-input",
      "keywords": [
        "manual",
        "input",
        "keyboard",
        "entry"
      ],
      "name": "Manual input"
    },
    {
      "category": "data",
      "id": "flowchart:document",
      "keywords": [
        "document",
        "report",
        "page",
        "print"
      ],
      "name": "Document"
    },
    {
      "category": "data",
      "id": "flowchart:multi-document",
      "keywords": [
        "documents",
        "multiple",
        "reports",
        "files"
      ],
      "name": "Multi document"
    },
    {
      "category": "data",
      "id": "flowchart:database",
      "keywords": [
        "database",
        "db",
        "storage",
        "disk",
        "cylinder"
      ],
      "name": "Database"
    },
    {
      "category": "data",
      "id": "flowchart:stored-data",
      "keywords": [
        "stored",
        "data",
        "storage",
        "save"
      ],
      "name": "Stored data"
    },
    {
      "category": "data",
      "id": "flowchart:internal-storage",
      "keywords": [
        "internal",
        "storage",
        "memory",
        "ram"
      ],
      "name": "Internal storage"
    },
    {
      "category": "data",
      "id": "flowchart:queue",
      "keywords": [
        "queue",
        "buffer",
        "messages",
        "fifo",
        "sequential"
      ],
      "name": "Queue"
    },
    {
      "category": "data",
      "id": "flowchart:display",
      "keywords": [
        "display",
        "screen",
        "monitor",
        "show"
      ],
      "name": "Display"
    },
    {
      "category": "data",
      "id": "flowchart:card",
      "keywords": [
        "card",
        "punched",
        "record"
      ],
      "name": "Card"
    },
    {
      "category": "flow",
      "id": "flowchart:connector",
      "keywords": [
        "connector",
        "jump",
        "reference",
        "circle"
      ],
      "name": "Connector"
    },
    {
      "category": "flow",
      "id": "flowchart:off-page-connector",
      "keywords": [
        "off-page",
        "connector",
        "continue",
        "page"
      ],
      "name": "Off-page connector"
    },
    {
      "category": "flow",
      "id": "flowchart:merge",
      "keywords": [
        "merge",
        "combine",
        "join",
        "triangle"
      ],
      "name": "Merge"
    },
    {
      "category": "flow",
      "id": "flowchart:extract",
      "keywords": [
        "extract",
        "split",
        "triangle"
      ],
      "name": "Extract"
    },
    {
      "category": "flow",
      "id": "flowchart:summing-junction",
      "keywords": [
        "summing",
        "junction",
        "and",
        "join"
      ],
      "name": "Summing junction"
    },
    {
      "category": "flow",
      "id": "flowchart:or",
      "keywords": [
        "or",
        "junction",
        "any"
      ],
      "name": "Or junction"
    },
    {
      "category": "flow",
      "id": "flowchart:annotation",
      "keywords": [
        "annotation",
        "comment",
        "note",
        "bracket"
      ],
      "name": "Annotation"
    }
  ],
  "format": "fluxion-shape-pack",
  "formatVersion": "1.0",
  "id": "flowchart",
  "license": "MIT",
  "name": "Flowchart",
  "version": "0.0.0"
}
